{"auth004_nonoverlap_status":"pending_sanitized_metadata_freeze","auth004_sanitized_metadata_sha256":"PENDING_FREEZE","cohort_manifest_sha256":"ddcbc3d16c57cbc9c02268bccb01eee223f3aa3f502cdfa7e449e8171a759e1a","diagnostic_in_headline_denominator":false,"exact_headline_denominator":"PENDING_FREEZE","phase_id":"phase11c-provider-canary-v1","proposed_headline_denominator":3,"schema_version":"phase11c-provider-canary-cohort/v1","source_kind":"deterministic_synthetic","target_limit":5,"targets":[{"payload_sha256":"0af27835bb7a909a85e38e17404915b8806cdaef07e85ad09d751ba5875fed5d","stable_id":"p11c-1207dbad4b888c12bfc703b51dc0463c"},{"payload_sha256":"ce6f18888fb6e78b7fd03e932ec9b7ed15e1662cd7264025991f0251bda43151","stable_id":"p11c-bb843bda5e0c283e00534906c2733c3f"},{"payload_sha256":"f48265776787985705ebfb66f94bc89dbde7136c05b0dcb106e2568cc883e3ab","stable_id":"p11c-f041de09e0de6b8915f3a42c0c7d561a"},{"payload_sha256":"06635c5c6809329a9bbf2e9bf8da105e15b65995fc4123741e9ec8cf865c513d","stable_id":"p11c-4d7706a83b1ccb27d0aa6727dd01161e"},{"payload_sha256":"d574073999e6b322c4f303d05d988761a1f754fca78dffcdef352a3620e0dc19","stable_id":"p11c-89b2f3709bb283262ea83c6e74e1d6b5"}]}
